{
  "$schema": "https://json-schema.org/draft/2020-12/schema",
  "$id": "urn:atlas-link:account:1",
  "title": "Atlas Link — cuenta de entrada v1",
  "description": "POST /api/accounts. MXN. El hospital se deriva de la identidad autenticada. No incluir nombres de pacientes; patientReference es una referencia seudonimizada. Idempotency-Key es obligatorio en la cabecera HTTP.",
  "type": "object",
  "required": ["folio", "patientReference", "insurerId", "admissionDate", "dischargeDate", "lines"],
  "properties": {
    "folio": {"type": "string", "minLength": 1, "maxLength": 64, "pattern": "\\S"},
    "patientReference": {"type": "string", "minLength": 1, "maxLength": 80, "pattern": "\\S"},
    "insurerId": {"type": "string", "format": "uuid"},
    "admissionDate": {"type": "string", "format": "date", "description": "Determina la vigencia del convenio aplicable."},
    "dischargeDate": {"type": "string", "format": "date", "description": "No puede ser anterior al ingreso ni posterior a hoy en America/Mexico_City; el servidor valida estas relaciones."},
    "policyNumber": {"type": ["string", "null"], "maxLength": 80},
    "diagnosis": {"type": ["string", "null"], "maxLength": 20},
    "policy": {
      "type": ["object", "null"],
      "description": "Parámetros confirmados de la póliza del paciente. Si faltan, el motor deja importes pendientes de revisión.",
      "properties": {
        "deductible": {"$ref": "#/$defs/policyMoney"},
        "coinsuranceRate": {"type": ["number", "null"], "minimum": 0, "maximum": 1, "multipleOf": 0.000001, "description": "Fracción: 0.10 equivale a 10 %."},
        "coinsuranceCap": {"$ref": "#/$defs/policyMoney"},
        "coverageAvailable": {"$ref": "#/$defs/policyMoney"}
      }
    },
    "lines": {
      "type": "array", "minItems": 1, "maxItems": 1000,
      "items": {
        "type": "object",
        "required": ["code", "description", "category", "quantity", "unitPrice"],
        "properties": {
          "code": {"type": "string", "minLength": 1, "maxLength": 40, "pattern": "\\S", "description": "El servidor elimina espacios, convierte a mayúsculas y admite únicamente A-Z, 0-9, punto, guion y guion bajo en el código normalizado."},
          "description": {"type": "string", "minLength": 1, "maxLength": 200, "pattern": "\\S"},
          "category": {"type": "string", "minLength": 1, "maxLength": 40, "pattern": "\\S"},
          "quantity": {"type": "number", "minimum": 0.001, "maximum": 99999999.999, "multipleOf": 0.001},
          "unitPrice": {"type": "number", "minimum": 0, "maximum": 9999999999.99, "multipleOf": 0.01}
        }
      }
    }
  },
  "$defs": {
    "policyMoney": {"type": ["number", "null"], "minimum": 0, "maximum": 999999999999.99, "multipleOf": 0.01}
  },
  "$comment": "Los campos desconocidos se ignoran en v1; no otorgan permisos ni cambian tenant. El servidor verifica convenio, licencia, unicidad, código normalizado y total <= 999999999999.99. La validación monetaria del backend usa BigDecimal; un validador JSON debe soportar decimales exactos. Este esquema describe la API síncrona implementada, no el endpoint asíncrono propuesto en el documento original."
}
